{
  "wrs_version": "1.0",
  "interval_id": "urn:example:interval:stable",
  "worldline_id": "urn:example:worldline:1",
  "regime": "stable",
  "start": {
    "system": "turn",
    "value": 1,
    "unit": "turn"
  },
  "end": {
    "system": "turn",
    "value": 8,
    "unit": "turn"
  },
  "status": "confirmed",
  "contract_ref": "urn:example:wrs:contract:1",
  "evidence_refs": [
    "urn:example:evidence:1"
  ],
  "conditions": [],
  "support": 0.9
}
